{
  "schema_version": 1,
  "id": "library",
  "name": "Library",
  "style_profile": "style.massive_gothic_manor",
  "palette": "composition.massive_gothic_manor",
  "density": 0.92,
  "shell": {
    "floor": true,
    "walls": true,
    "ceiling": true,
    "wall_height": 13
  },
  "connectors": [
    {
      "id": "entry",
      "side": "south",
      "center": "center",
      "width": 5,
      "height": 4,
      "depth": 2,
      "clearance": 4
    }
  ],
  "slots": [
    {
      "id": "books_nw",
      "selector": {
        "category": "furniture",
        "families": [
          "storage"
        ]
      },
      "target": {
        "x": "27%",
        "y": 1,
        "z": "min+2"
      },
      "preferred_ids": [
        "bookcase_wall"
      ],
      "required": true,
      "placement_mode": "carve_and_place"
    },
    {
      "id": "books_ne",
      "selector": {
        "category": "furniture",
        "families": [
          "storage"
        ]
      },
      "target": {
        "x": "73%",
        "y": 1,
        "z": "min+2"
      },
      "preferred_ids": [
        "bookcase_wall"
      ],
      "required": true,
      "placement_mode": "carve_and_place"
    },
    {
      "id": "books_w",
      "selector": {
        "category": "furniture",
        "families": [
          "storage"
        ]
      },
      "target": {
        "x": "min+2",
        "y": 1,
        "z": "68%"
      },
      "preferred_ids": [
        "bookcase_wall"
      ],
      "rotation": 1,
      "placement_mode": "carve_and_place",
      "probability": 0.85
    },
    {
      "id": "fireplace_e",
      "selector": {
        "category": "architecture",
        "families": [
          "fireplaces"
        ]
      },
      "target": {
        "x": "max-3",
        "y": 1,
        "z": "center"
      },
      "preferred_ids": [
        "gothic_fireplace",
        "manor_fireplace"
      ],
      "rotation": 3,
      "placement_mode": "carve_and_place",
      "required": true,
      "max_repeats": 1
    },
    {
      "id": "table_left",
      "selector": {
        "category": "furniture",
        "families": [
          "tables"
        ]
      },
      "target": {
        "x": "35%",
        "y": 1,
        "z": "55%"
      },
      "preferred_ids": [
        "library_table"
      ],
      "required": true
    },
    {
      "id": "table_right",
      "selector": {
        "category": "furniture",
        "families": [
          "tables"
        ]
      },
      "target": {
        "x": "65%",
        "y": 1,
        "z": "55%"
      },
      "preferred_ids": [
        "library_table"
      ],
      "required": false,
      "probability": 0.8
    },
    {
      "id": "desk",
      "selector": {
        "category": "furniture",
        "families": [
          "desks"
        ]
      },
      "target": {
        "x": "center",
        "y": 1,
        "z": "23%"
      },
      "preferred_ids": [
        "writing_desk"
      ],
      "probability": 0.85
    },
    {
      "id": "chair_sw",
      "selector": {
        "category": "furniture",
        "families": [
          "seating"
        ]
      },
      "target": {
        "x": "18%",
        "y": 1,
        "z": "78%"
      },
      "preferred_ids": [
        "gothic_armchair"
      ],
      "probability": 0.8
    },
    {
      "id": "chair_se",
      "selector": {
        "category": "furniture",
        "families": [
          "seating"
        ]
      },
      "target": {
        "x": "82%",
        "y": 1,
        "z": "78%"
      },
      "preferred_ids": [
        "gothic_armchair"
      ],
      "probability": 0.8
    },
    {
      "id": "chandelier",
      "selector": {
        "category": "decor",
        "families": [
          "lighting"
        ]
      },
      "target": {
        "x": "center",
        "y": "ceiling-11",
        "z": "center"
      },
      "preferred_ids": [
        "grand_chandelier"
      ],
      "required": true,
      "max_repeats": 1
    },
    {
      "id": "planter",
      "selector": {
        "category": "vegetation",
        "families": [
          "planters"
        ]
      },
      "target": {
        "x": "14%",
        "y": 1,
        "z": "23%"
      },
      "preferred_ids": [
        "indoor_planter"
      ],
      "probability": 0.45,
      "max_repeats": 1
    }
  ]
}
